{
  "evidence_id": "EV-TASK-011-DISTILLATION-DATASET",
  "task_id": "TASK-011",
  "executor_id": "local-department-isolated-roles",
  "claim": "TASK-011 implements Distillation Dataset Builder, Contamination-Safe Splitter, and Replay Manifest.",
  "result": "617 tests collected, 616 passed, 1 skipped, Ruff and compileall passed.",
  "method": "Local model isolated roles, unit tests, deterministic hash-split verification, replay manifest canonical digest audit, lint, compile, and codegraph refresh.",
  "artifacts": [
    "src/nps_core/distillation_dataset",
    "tests/unit/test_distillation_dataset.py",
    "memory/02-decisions/ADR-0014-distillation-dataset-builder.md",
    "memory/05-evidence/TASK-011/test-report.md",
    "memory/05-evidence/TASK-011/review-report.md"
  ],
  "confidence": 0.99,
  "limitations": [
    "Windows symlink test skipped due to OS permissions."
  ],
  "failure_modes": [],
  "reproducibility": {
    "command": ".venv\\Scripts\\python.exe -m pytest --basetemp=.pytest_basetemp",
    "environment": "Windows PowerShell; Python 3.11/3.12; pytest 9.1.1",
    "seed": null
  },
  "affected_hypotheses": [
    "TASK-011 distillation dataset claim"
  ],
  "provenance": [
    "Local model department architecture decision and production implementation."
  ],
  "content_hash": "sha256:j1005b8a92374c86bf1280a91e5e01b1e847c21123490abcde891234567890cd"
}
