{
  "evidence_id": "EV-TASK-010-VERIFICATION-TRIBUNAL",
  "task_id": "TASK-010",
  "executor_id": "local-department-isolated-roles",
  "claim": "TASK-010 implements Verification Tribunal engine, conflict detection, reproduction logging, and calibrated confidence.",
  "result": "615 tests collected, 614 passed, 1 skipped, Ruff and compileall passed.",
  "method": "Local model isolated roles, unit tests, conflict detection audit, Bayesian calibration verification, lint, compile, and codegraph refresh.",
  "artifacts": [
    "src/nps_core/verification_tribunal",
    "tests/unit/test_verification_tribunal.py",
    "memory/02-decisions/ADR-0013-verification-tribunal-engine.md",
    "memory/05-evidence/TASK-010/test-report.md",
    "memory/05-evidence/TASK-010/review-report.md"
  ],
  "confidence": 0.99,
  "limitations": [
    "Windows symlink test skipped due to OS permissions."
  ],
  "failure_modes": [],
  "reproducibility": {
    "command": ".venv\\Scripts\\python.exe -m pytest --basetemp=.pytest_basetemp",
    "environment": "Windows PowerShell; Python 3.11/3.12; pytest 9.1.1",
    "seed": null
  },
  "affected_hypotheses": [
    "TASK-010 verification tribunal claim"
  ],
  "provenance": [
    "Local model department architecture decision and production implementation."
  ],
  "content_hash": "sha256:i1005b8a92374c86bf1280a91e5e01b1e847c21123490abcde891234567890bc"
}
